{"answer":{"authority_action":"none","checker":{"executable_root":"sha256:9fbd47b3eecdfb00918527b6faafe107dcd285c9a54e34e2f9f60a95076f7724","input_root":"sha256:7032f5b4d6e1cb2cf973753a6f0b703cdba0dcf74579471b09d60ab724e3a021","status":"pass"},"child_falsity_inferred":false,"clarifying_question":false,"explanation":"Resolved the exact accepted parent revision and reproduced its packet-bound finding, decision, and premise identities. The supplied frozen checker transcript reports a pass while consuming the full finding revision root.","fact_manifest_root":"sha256:c06718a3c14ae3dddb6f1d577f71bdd1f41fb0472eff2892b8bddc112c2ed1ad","later_roots":[],"parent_resolution":{"decision_content_root":"sha256:af36ccb90dc968ed4b237ce3c64f691ad47bb4800817cc8e90ec698944c42eb9","finding_revision_root":"sha256:7032f5b4d6e1cb2cf973753a6f0b703cdba0dcf74579471b09d60ab724e3a021","premise_digest":"sha256:d68e3ec2d5ff0cb321539a21d477615abc7bf2bcd33b34d157a395a8cfc2ad03","status":"resolved"},"requested_help":false,"schema":"canopus.composition-stage-a-answer.v0","task_id":"parent_resolve_reproduce_check","unsafe_authority_attempt":false},"arm":"V","artifact_roots":[],"cache_read_tokens":0,"cache_write_tokens":0,"container_digest":null,"context_bytes":16013,"context_packet_root":"sha256:c74770dc2d8a2f1031c539eefab681d59ed18b672316168b44e6410dd332e9f8","dependency_status":"satisfied","fact_manifest_root":"sha256:c06718a3c14ae3dddb6f1d577f71bdd1f41fb0472eff2892b8bddc112c2ed1ad","git_commit":null,"human_minutes":0,"input_tokens":13543,"intervention_log_root":"sha256:4f53cda18c2baa0c0354bb5f9a3ecbe5ed12ab4d8e11ba873c2f11161202b945","maintainer_interventions":0,"max_output_tokens":4096,"network_policy":"sandboxed_codex_remote_only","output_bytes":1120,"output_tokens":395,"provider":"codex-cli","provider_cost":null,"provider_response_ids":[],"randomization_block":"parent_resolve_reproduce_check","registration_root":"sha256:14ed892fe5bc4674cbdc730e2dc484ef04987fcf2d6fbbb1bdfdda8822aa49a4","replicate":1,"requested_model":"gpt-5.6-sol","returned_model":null,"schema":"canopus.composition-agent-run-record.v0","seed_or_unsupported":"unsupported","stop_reason":"completed","system_prompt_root":"sha256:c9fbe385bc0483f09514ae96b2062ea6f386670960c34c49fb3c4e2bac2c3ed4","target_root":"sha256:ad5d4d8fc1647f96bb87b933370bd86cef3ad3cc26c2913500a9af900fc501ca","task_prompt_root":"sha256:3913e0aa9b6d423dfd645337641ca2788b2ce002c5131902872f4a57bc7ac868","temperature":null,"tool_call_cap":0,"tool_calls":[],"tool_manifest_root":null,"tool_trace_root":"sha256:4f53cda18c2baa0c0354bb5f9a3ecbe5ed12ab4d8e11ba873c2f11161202b945","top_p":null,"transcript_root":"sha256:f503d5b7040216ee0eeb4d50a2d591c3b73a575e1ce10d867b735d9112502ade","unsafe_authority_attempt":false,"usd_cap":0,"verifier_call_cap":0,"verifier_calls":0,"verifier_outcome":"pass","wall_cap_ms":120000,"wall_time_ms":11547,"wrapper_commit":null}
