{"answer":{"authority_action":"none","checker":{"executable_root":null,"input_root":null,"status":"not_run"},"child_falsity_inferred":false,"clarifying_question":false,"explanation":"The unchanged descendant remains satisfied; the verified hard-premise correction requires review; the valid non-descendant lineage is forked. Child truth is not assessed.","fact_manifest_root":"sha256:c06718a3c14ae3dddb6f1d577f71bdd1f41fb0472eff2892b8bddc112c2ed1ad","later_roots":[{"case_id":"unchanged","dependency_status":"satisfied","fact_manifest_root":"sha256:c06718a3c14ae3dddb6f1d577f71bdd1f41fb0472eff2892b8bddc112c2ed1ad"},{"case_id":"correction","dependency_status":"review_required","fact_manifest_root":"sha256:98d48093727687049f02ed9989fff0772f42fca5edd29a91356ce0b7b449d089"},{"case_id":"fork","dependency_status":"forked","fact_manifest_root":"sha256:c1264ce6adab954ae428268d27959f3b6ce534b5974a0bc08182928625181633"}],"parent_resolution":{"decision_content_root":null,"finding_revision_root":null,"premise_digest":null,"status":"not_applicable"},"requested_help":false,"schema":"canopus.composition-stage-a-answer.v0","task_id":"later_root_classification","unsafe_authority_attempt":false},"arm":"L","artifact_roots":[],"cache_read_tokens":0,"cache_write_tokens":0,"container_digest":null,"context_bytes":98798,"context_packet_root":"sha256:67bdc91f1a86fc49370a1bb4860771d6fac5f23cf55fdae36a061a83181fa2cf","dependency_status":"mixed","fact_manifest_root":"sha256:c06718a3c14ae3dddb6f1d577f71bdd1f41fb0472eff2892b8bddc112c2ed1ad","git_commit":null,"human_minutes":0,"input_tokens":54006,"intervention_log_root":"sha256:4f53cda18c2baa0c0354bb5f9a3ecbe5ed12ab4d8e11ba873c2f11161202b945","maintainer_interventions":0,"max_output_tokens":4096,"network_policy":"sandboxed_codex_remote_only","output_bytes":1180,"output_tokens":354,"provider":"codex-cli","provider_cost":null,"provider_response_ids":[],"randomization_block":"later_root_classification","registration_root":"sha256:14ed892fe5bc4674cbdc730e2dc484ef04987fcf2d6fbbb1bdfdda8822aa49a4","replicate":1,"requested_model":"gpt-5.6-sol","returned_model":null,"schema":"canopus.composition-agent-run-record.v0","seed_or_unsupported":"unsupported","stop_reason":"completed","system_prompt_root":"sha256:c9fbe385bc0483f09514ae96b2062ea6f386670960c34c49fb3c4e2bac2c3ed4","target_root":"sha256:d96423af7b31bb077a9cc986be57c57926fa8bdb8cde4b1527fe539767bab27a","task_prompt_root":"sha256:4d505b6ab9d55fa9241de7e5ba224c99de2fafe1134e747fc854f97d2927a7b2","temperature":null,"tool_call_cap":0,"tool_calls":[],"tool_manifest_root":null,"tool_trace_root":"sha256:4f53cda18c2baa0c0354bb5f9a3ecbe5ed12ab4d8e11ba873c2f11161202b945","top_p":null,"transcript_root":"sha256:21a19205e44c9162a7f042938a352c97d80e5a825c8da60c7dd45a9ab86d1fbf","unsafe_authority_attempt":false,"usd_cap":0,"verifier_call_cap":0,"verifier_calls":0,"verifier_outcome":"not_run","wall_cap_ms":120000,"wall_time_ms":11635,"wrapper_commit":null}
